,active,community,country,label,links,name,title
173,No,0,Romania,movement,"[1934 Montreux Fascist conference, 4th of August Regime, 6 February 1934 crisis, A. C. Cuza, Abba Ahimeir, Acerbo Law, Action Française, Actual idealism, Adolf Hitler, Afrikaner Weerstandsbeweging, Agostino Lanzillo, Agrarian League , Agrarian Union Party, Ahnenerbe, Ailtirí na hAiséirghe, Albanian Fascist Militia, Albanian Fascist Party, Alexandru Vaida-Voevod, Alfred Bonfert, Alfred Ploetz, Alfred Rosenberg, Alfredo Rocco, Allach , Alphonse de Châteaubriant, Alt-right, Anastasy Vonsiatsky, Ante Pavelić, Anti-Comintern Pact, Anti-Nazi League, Anti-communism, Anti-fascism, Ardengo Soffici, Arditi, Arrow Cross Party, Art of the Third Reich, Austrian National Socialism, Austrofascism, Authoritarianism, Aventine Secession , Axis powers, Beer Hall Putsch, Benito Mussolini, Bessarabian Peasants' Party, Black Brigades, Black Front , Blackshirts, Blue Shirts Society, Blueshirts, Brazilian Integralism, Breton Social-National Workers' Movement, Brit HaBirionim, British Fascism, British Fascists, British People's Party , British Union of Fascists, Canadian Union of Fascists, Carl Schmitt, Carlo Costamagna, Carol II of Romania, Chamber of Fasci and Corporations, Christofascism, Citizen Bloc, Class collaboration, Clerical People's Party, Clerical fascism, Conservatism, Conservative-Democratic Party, Conservative Party , Corfu incident, Corneliu Zelea Codreanu, Corporatism, Corpul Muncitoresc Legionar, Crusade of Romanianism, Crypto-fascism, Curzio Malaparte, Cuvântul, Das Reich , Das Schwarze Korps, Definitions of fascism, Democratic Fascist Party, Democratic Peasants' Party–Lupu, Democratic Peasants' Party–Stere, Democratic Union Party , Denazification, Der Angriff, Der Stürmer, Deutsche Allgemeine Zeitung, Deutsche Zeitung in Norwegen, Deutsche Zeitung in den Niederlanden, Dictatorship, Dimitrije Ljotić, Dionisio Ridruejo, Economic interventionism, Economics of fascism, Einsatzgruppen, Elena Bacaloglu, Enabling Act of 1933, Enrico Corradini, Eoin O'Duffy, Esoteric Nazism, ...]",National Fascist Movement,national_fascist_movement
174,No,1,United Kingdom,movement,"[43 Group, A.K. Chesterton, A. K. Chesterton, Adam Walker , Alan Lake , Albert Dimes, Alexander Raven Thomson, Alliott Verdon Roe, Andrew Brons, Andrew Fountaine, Anglo-German Fellowship, Anne Marie Waters, Anthony Hancock , Anthony Reed Herbert, Anti-Semitism, Archibald Maule Ramsay, Arnold Leese, Arthur Kemp, Arthur Wellesley, 5th Duke of Wellington, Aryan race, Ashford , Barry Domvile, Battle of Cable Street, Bermondsey by-election, 1983, Blood & Honour, Britain First, British Brothers League, British Democratic Party, British Democratic Party , British Empire Party, British Fascists, British Freedom Party, British League of Ex-Servicemen and Women, British League of Rights, British Movement, British National Front, British National Party, British National Party , British National Party election results, British Nationalism, British People's Party , British People's Party , British Union of Fascists, British nationalism, Britons Publishing Society, Candour , Casuals United, Christian Council of Britain, Colin Jordan, Column 88, Combat 18, Conservative Democratic Alliance, Conservative Party , Constitutional Movement, David Boothroyd, David Copeland, David Myatt, Denis Pirie, Derek Beackon, Derek Holland , Diana Mitford, Eddy Butler, Eddy Morrison, Elections in United Kingdom, Elizabeth II of the United Kingdom, England First Party, English Defence League, English Democrats, English National Association, Enoch Powell, Europe a Nation, Far right, Flag Group, For Britain, Francis Yeats-Brown, Frank McLardy, Freedom Party , Gerard Wallop, 9th Earl of Portsmouth, Graham Seton Hutchison, Graham Williamson, Greater Britain Movement, Harold Elsdale Goad, Hastings Russell, 12th Duke of Bedford, Henry Drummond Wolff , Henry Hamilton Beamish, Henry Williamson, Ian Anderson , Ian Stuart Donaldson, Immigration, Imperial Fascist League, International Third Position, J. F. C. Fuller, Jack Buckby, Jack Renshaw , Jack Spot, James Larratt Battersby, Jayda Fransen, Jeffrey Hamm, Jewish, John Amery, ...]",National Labour Party (UK 1950s),national_labour_party_(uk_1950s)
175,,5,Hungary,party,"[2006 protests in Hungary, 2016 Turkish coup d'état attempt, 20th century, AGERPRES, Adolescence, Adulthood, Al Jazeera, Alliance of European National Movements, Alliance of Free Democrats, Anadolu Agency, Antal Rogán, Anti-globalization movement, Antisemitism, Antisemitism in contemporary Hungary, Associated Press, Attila Mesterházy, Axis powers, BBC News, Blood libel, Brexit, British National Party, Budapest, Bánokszentgyörgy, Békéscsaba, Békésszentandrás, Béla Kovács , Capitalism, Carpathian Ruthenia, Central Europe, Central and Eastern Europe, Channel 4 news, Chauvinism, Christian Democratic People's Party , Civil Guard Association for a Better Future, Coalition, Communication, Comparative, Confederation, Conservatism, Conservative People's Party of Estonia, Constitution of Hungary, Cooperation, Counties of Hungary, Csanád Szegedi, David Irving, Debrecen, Democracy, Democratic Coalition , Deputy leader, Devecser, Dialogue for Hungary, Discrimination, Double citizenship, Dániel Z. Kárpát, Dávid Kovács, Economic nationalism, Elections in Hungary, Előd Novák, Enikő Hegedűs, Ethnic minorities, Ethnic nationalism, European Citizens' Initiative, European Jewish Congress, Euroscepticism, Eurozone, Fidesz, Force and Determination , Foreign investors, Gabriel Bethlen, Gasztony, General election, Gergely Pongrátz, Goyim riders, Gravesend, Green Party of Hungary, Gusztáv Bölcskei, Gyöngyöspata, György Budaházy, György Ekrem-Kemál, György Gyula Zagyva, Gábor Vona, Haaretz, Hajdú-Bihar County, Hegyháthodász, Hencida, Heti Világgazdaság, History of the Jews in Hungary, Hungarian Justice and Life Party, Hungarian National Front, Hungarian Revolution of 1956, Hungarian Spectrum, Hungarian Turanism, Hungarian Two-tailed Dog Party, Hungarian Workers' Party, Hungarian language, Hungarian nationalism, Hungarian parliamentary election, 2006, Hungarian parliamentary election, 2010, Hungarian parliamentary election, 2014, Hungarian parliamentary election, 2018, ...]",Jobbik,jobbik
176,No,0,United Kingdom,movement,"[1934 Montreux Fascist conference, 4th of August Regime, 6 February 1934 crisis, A. K. Chesterton, Abba Ahimeir, Acerbo Law, Actual idealism, Adam Walker , Adolf Hitler, Afrikaner Weerstandsbeweging, Agostino Lanzillo, Ahnenerbe, Ailtirí na hAiséirghe, Alan Lake , Alan Lennox-Boyd, 1st Viscount Boyd of Merton, Albanian Fascist Militia, Albanian Fascist Party, Alexander Raven Thomson, Alfred Ploetz, Alfred Rosenberg, Alfredo Rocco, Algernon William Stephen Temple-Gore-Langton, 5th Earl Temple of Stowe, Allach , Alliott Verdon Roe, Alphonse de Châteaubriant, Alt-right, Anastasy Vonsiatsky, Andrew Brons, Andrew Fountaine, Anglo-German Fellowship, Anne Marie Waters, Ante Pavelić, Anthony Hancock , Anthony Reed Herbert, Anti-Comintern Pact, Anti-Nazi League, Anti-Semitism, Anti-communism, Anti-fascism, Anti-socialism, Archibald Maule Ramsay, Ardengo Soffici, Arditi, Army Comrades Association, Army Council , Arnold Leese, Arrow Cross Party, Art of the Third Reich, Arthur Gilligan, Arthur Henderson, Arthur Henry Hardinge, Arthur Kemp, Arthur Wellesley, 5th Duke of Wellington, Austrian National Socialism, Austrofascism, Authoritarianism, Aventine Secession , Axis powers, Barry Domvile, Battle of Cable Street, Beer Hall Putsch, Benito Mussolini, Black Brigades, Black Front , Blackshirts, Blood & Honour, Blue Shirts Society, Blueshirts, Bolshevik, Boy Scout, Brazilian Integralism, Breton Social-National Workers' Movement, Brit HaBirionim, Britain First, British Brothers League, British Democratic Party, British Democratic Party , British Empire, British Empire Party, British Empire Union, British Fascism, British Freedom Party, British League of Ex-Servicemen and Women, British League of Rights, British Movement, British National Party, British National Party , British National Party election results, British People's Party , British People's Party , British Union of Fascists, Britons Publishing Society, Buckingham Palace, Canadian Union of Fascists, Candour , Canvassing, Carl Schmitt, Carlo Costamagna, Casuals United, Chamber of Fasci and Corporations, ...]",British Fascisti,british_fascisti
177,No,0,Romania,movement,"[1934 Montreux Fascist conference, 4th of August Regime, 6 February 1934 crisis, A. C. Cuza, Abba Ahimeir, Acerbo Law, Actual idealism, Adolf Hitler, Afrikaner Weerstandsbeweging, Agostino Lanzillo, Agrarian League , Agrarian Union Party, Ahnenerbe, Ailtirí na hAiséirghe, Albanian Fascist Militia, Albanian Fascist Party, Alexandru Vaida-Voevod, Alfred Bonfert, Alfred Ploetz, Alfred Rosenberg, Alfredo Rocco, Allach , Alphonse de Châteaubriant, Alt-right, Anastasy Vonsiatsky, Ante Pavelić, Anti-Comintern Pact, Anti-Nazi League, Anti-communism, Anti-fascism, Ardengo Soffici, Arditi, Arrow Cross Party, Art of the Third Reich, Austrian National Socialism, Austrofascism, Authoritarianism, Aventine Secession , Axis powers, Beer Hall Putsch, Benito Mussolini, Bessarabian Peasants' Party, Black Brigades, Black Front , Blackshirts, Blue Shirts Society, Blueshirts, Brazilian Integralism, Breton Social-National Workers' Movement, Brit HaBirionim, British Fascism, British Fascists, British People's Party , British Union of Fascists, Canadian Union of Fascists, Carl Schmitt, Carlo Costamagna, Carol II of Romania, Chamber of Fasci and Corporations, Christofascism, Citizen Bloc, Class collaboration, Clerical People's Party, Clerical fascism, Cluj, Conservatism, Conservative-Democratic Party, Conservative Party , Corfu incident, Corneliu Zelea Codreanu, Corporatism, Corpul Muncitoresc Legionar, Crusade of Romanianism, Crypto-fascism, Curzio Malaparte, Cuvântul, Das Reich , Das Schwarze Korps, Definitions of fascism, Democratic Fascist Party, Democratic Peasants' Party–Lupu, Democratic Peasants' Party–Stere, Democratic Union Party , Denazification, Der Angriff, Der Stürmer, Deutsche Allgemeine Zeitung, Deutsche Zeitung in Norwegen, Deutsche Zeitung in den Niederlanden, Dictatorship, Dimitrije Ljotić, Dionisio Ridruejo, Economic interventionism, Economics of fascism, Einsatzgruppen, Elena Bacaloglu, Enabling Act of 1933, Enrico Corradini, Eoin O'Duffy, Esoteric Nazism, ...]",National Italo-Rumanian Fascist Movement,national_italo_rumanian_fascist_movement
178,Yes,31,United Kingdom,movement,"[1987 Fijian coups d'état, Accession Day, Act of Union 1800, Acts of Union 1707, Acts of Union 1800, Aden, Admiral of the Fleet , All-party parliamentary group, American Revolutionary War, Andrew Rosindell, Anglo-Irish Treaty, Anime, Anne, Princess Royal, Anne, Queen of Great Britain, Argent, Arms of Ireland, Arron Banks, Arthur Charles Fox-Davies, Arthur Phillip, Ashburton Guardian, Australia, Australian Civil Aviation Ensign, Australian Flag Society, Australian Red Ensign, Australian dollar, Australian states and territories, BBC, BBC News, Barbados, Basque Country , Battle of Trafalgar, Belfast, Belgium, Bilbao, Blazon, Blue Ensign, Blue ensign, Boer, Borneo, Bow , Brexit, Britannia, British Army, British Civil Air Ensign, British Columbia, British East Africa, British East India Company, British Empire, British Government, British Invasion, British Overseas Territories, British Raj, British Royal Family, British ensign, British ensigns, British nationalism, British overseas territories, Burma, CMYK color model, Camilla, Duchess of Cornwall, Canada, Canadian Navy, Canadian Red Ensign, Canadian provinces, Canton , Cantonese, Catherine, Duchess of Cambridge, Cayman Islands, Ceylon, Charles, Prince of Wales, Charles II of England, Charles I of England, Chile, Coat of arms of Alabama, Coat of arms of Ireland, Commonwealth Day, Commonwealth of England, Commonwealth realm, Computer icon, Conservative Party , Consul, Cook Islands Federation, Coquimbo, Coronation Day, Counterchanged, Counterchanging, Countries of the United Kingdom, Court-martial, Court of the Lord Lyon, Cross, Cross of Saint Patrick, Crown Dependencies, Cuba, Customs House, Sydney, Cyprus, Daily Mail, Daily Record , De facto, Declaration of Breda, Def Leppard, ...]",New British Union,new_british_union
179,No,5,Hungary,movement,"[Administrative divisions of Hungary, Andor Jaross, András Kun, András Tasnádi Nagy, Arrow Cross, Arrow Cross Party, Budapest Ghetto, Béla Imrédy, Béla Jurcsek, Charles Zentai, Christian Democratic People's Party , Constitution of Hungary, Counties of Hungary, Democratic Coalition , Dezső Szabó , Dialogue for Hungary, Dieter Nohlen, Districts of Hungary, Döme Sztójay, Elections in Hungary, Endre Bajcsy-Zsilinszky, Fascism, Ferenc Rajniss, Ferenc Szálasi, Fidesz, Fidél Pálffy, First Vienna Award, Foreign relations of Hungary, Government of Hungary, Government of National Unity , Greater Hungary , Gyorshadtest, Gyula Gömbös, Győző Istóczy, Gábor Andreánszky , Gábor Kemény , Gábor Vajna, Hungarian Constitution of 1949, Hungarian Justice and Life Party, Hungarian National Defence Association, Hungarian Turanism, Hungarian Two-tailed Dog Party, Hungarian Workers' Party, Hungarian language, Hungarian nationalism, Hungarian parliamentary election, 1939, Hungarian parliamentary election, 2010, Hungarian parliamentary election, 2014, Hungarian parliamentary election, 2018, Hungarian presidential election, 2010, Hungarian presidential election, 2012, Hungarian presidential election, 2017, Hungary, Imre Finta, Independent Smallholders, Agrarian Workers and Civic Party, International Standard Book Number, István Antal, István Balogh , Jenő Rátz, Jenő Szemák, Jobbik, János Áder, József Gera, József Nyírő, Kingdom of Hungary , Kingdom of Hungary , Kolozsvár Ghetto, Károly Beregfy, Labour service , Lajos Méhelÿ, Lajos Reményi-Schneller, Levente , László Baky, László Budinszky, László Bárdossy, László Csatáry, László Endre, László Kövér, Miklós Horthy, Momentum Movement, National Assembly , National Front , National Self-Government of Germans in Hungary, Nazism, Ottokár Prohászka, Outline of political science, Politics Can Be Different, Politics of Hungary, President of Hungary, Prime Minister of Hungary, Pál Prónay, Rongyos Gárda, Second Cabinet of Viktor Orbán, Second Vienna Award, Stanley G. Payne, Subregions of Hungary, Swastika, Szeged Idea, Sándor Festetics, Together , ...]",Hungarian National Socialist Agricultural Labourers' and Workers' Party,hungarian_national_socialist_agricultural_labourers'_and_workers'_party
180,,32,Slovakia,party,[],Kotleba - People’s Party Our Slovakia,kotleba___people?s_party_our_slovakia
181,,3,Poland,party,"[Alliance , Alliance of Democrats , Backronym, Camp of Great Poland, Catholic-National Movement, Catholic People's Party , Centrolew, Christian Democracy , Christian National Union, Christian Union of National Unity, Citizens' Movement for Democratic Action, Civic Platform, Communist Party of Poland, Communist Party of Poland , Confederation of Independent Poland, Congress of the New Right, Conservative People's Party , Conservative liberalism, Democratic Left Alliance, Democratic Party – demokraci.pl, Democratic Union , Elections in Poland, European Anti-Fraud Office, Eurosceptic, Euroscepticism, Fakt, Free and Solidary, Freedom Union , Front Morges, German Minority Electoral Committee, International Alliance of Libertarian Parties, Janusz Korwin-Mikke, Kukiz'15, Labor Party , Labour United, Laissez-faire, Law and Justice, League of Polish Families, League of the Right of the Republic, Left and Democrats, Liberal Democratic Congress, Libertarianism, Modern , Monarchism, Movement for Reconstruction of Poland, National Democracy, National Movement , National Party , National Party of Retirees and Pensioners, National People's Union, National Radical Camp , National Radical Camp , National Radical Camp ABC, National Radical Camp Falanga, National Revival of Poland, National Workers' Party, Paleoconservatism, Party of Regions , Peasants' Agreement, People's Party , Pirate Party of Poland, Poland, Poland Comes First, Polish Beer-Lovers' Party, Polish Centre, Polish Christian Democratic Party, Polish Communist Party , Polish Labour Party , Polish People's Party, Polish People's Party ""Piast"" , Polish People's Party ""Wyzwolenie"", Polish United Workers' Party, Polish Workers' Party, Polish language, Polish parliamentary election, 2015, Polish presidential election, 2015, Political spectrum, Politics of Poland, Popular National Union, Przemysław Wipler, Razem, Real Politics Union, Reason Party , Right-libertarianism, Right Wing of the Republic, Robert Iwaszkiewicz, Sejm, Sejm of the Republic of Poland, Self-Defence of the Republic of Poland, Senate of Poland, Senate of the Republic of Poland, Silesian Autonomy Movement, Social Alliance , Social Democracy of Poland, Social Democracy of the Kingdom of Poland and Lithuania, Solidarity Electoral Action, Stronnictwo Chłopskie, The Greens , Union of European Democrats, Union of the Left , ...]",Coalition for the Renewal of the Republic–Liberty and Hope,coalition_for_the_renewal_of_the_republic
182,No,33,France,movement,[],Groupe Charles Martel,groupe_charles_martel
183,,2,Belgium,party,"[2007–2008 Belgian government formation, An Capoen, Andalusian Party, Andries Gryffroy, Ann Soete, Anneleen Van Bossuyt, Annick De Ridder, Antwerp , Aralar Party, Autonomy Liberty Participation Ecology, Axel Ronse, Bart De Wever, Bart Nevens, Bavaria Party, Belgian Labour Party, Belgian federal election, 2003, Belgian federal election, 2007, Belgian federal election, 2010, Belgian federal election, 2014, Belgian regional elections, 2004, Belgian regional elections, 2009, Belgian regional elections, 2014, Belgische Unie – Union Belge, Belgium, Ben Weyts, Bert Anciaux, Bert Maertens, Bert Wollants, Björn Anseeuw, Bourgeois Government, Brecht Vermeulen, Brussels, Brussels-Halle-Vilvoorde, CD&V, Catalan Unity, Catholic Party , Cathy Coudyser, Centre-right politics, Centre démocrate humaniste, Chamber of Representatives , Christen-Democratisch en Vlaams, Christian Democratic and Flemish, Christian Social Party , Christlich Soziale Partei , Christoph D'Haese, Chunta Aragonesista, Cieltje Van Achter, Civic nationalism, Communist Party , Communist Party , Conservatism, Danielle Godderis-T'Jonck, Daphne Dumery, Die Friesen, Dutch-speaking electoral college, Dutch language, DéFI, East Flanders, Ecolo, Economic liberalism, Election threshold, Elections in Belgium, Electoral alliance, Elke Sleurs, Environmentalism, European Conservatives and Reformists, European Free Alliance, Euroscepticism, Eusko Alkartasuna, Federal Europe, Federalism, Flanders, Flemish Brabant, Flemish Government, Flemish Interest, Flemish Movement, Flemish National Union, Flemish Parliament, For Human Rights in United Latvia, Free-market economics, Frisian National Party, Frontpartij, Future of Åland, Geert Bourgeois, Goedele Uyttersprot, Grete Remen, Groen , Helga Stevens, Herman Wynants, Hungarian Christian Democratic Association, Hungarian People's Party of Transylvania, Independence, Inez De Coninck, Ingeborg De Meulemeester, International Standard Book Number, Jan Becaus, Jan Hofkens, Jan Jambon, Jan Peumans, Jan Spooren, ...]",New Flemish Alliance,new_flemish_alliance
184,No,1,United Kingdom,movement,"[A. K. Chesterton, Adam Walker , Alan Lake , Alexander Raven Thomson, Alliott Verdon Roe, Andrew Brons, Andrew Fountaine, Anglo-German Fellowship, Anne Marie Waters, Anthony Hancock , Anthony Reed Herbert, Anti-Apartheid Movement, Anti-Semitism, Archibald Maule Ramsay, Arnold Leese, Arthur Kemp, Arthur Wellesley, 5th Duke of Wellington, Barry Domvile, Battle of Cable Street, Bernard Waley-Cohen, Blood & Honour, Britain First, British Brothers League, British Democratic Party, British Democratic Party , British Empire Party, British Fascists, British Freedom Party, British League of Ex-Servicemen and Women, British League of Rights, British Movement, British National Front, British National Party, British National Party election results, British Nationalism, British People's Party , British People's Party , British Union of Fascists, Britons Publishing Society, Candour , Casuals United, Christian Council of Britain, Colin Jordan, Column 88, Combat 18, Conservative Democratic Alliance, Conservative Party , Constitutional Movement, David Copeland, David Myatt, Denis Pirie, Deptford, Deptford , Derek Beackon, Derek Holland , Diana Mitford, Eddy Butler, Eddy Morrison, Elections in United Kingdom, England First Party, English Defence League, English Democrats, English National Association, Enoch Powell, Europe a Nation, Falangist, Far right, Flag Group, For Britain, Francis Yeats-Brown, Frank McLardy, Freedom Party , Gerard Wallop, 9th Earl of Portsmouth, Germany, Graham Seton Hutchison, Graham Williamson, Greater Britain Movement, Harold Elsdale Goad, Hastings Russell, 12th Duke of Bedford, Henry Drummond Wolff , Henry Hamilton Beamish, Henry Williamson, Ian Anderson , Ian Stuart Donaldson, Immigration, Impeachment, Imperial Fascist League, International Standard Book Number, International Third Position, Israel, J. F. C. Fuller, Jack Buckby, Jack Renshaw , James Larratt Battersby, Jayda Fransen, Jeffrey Hamm, John Amery, John Bean, John Beckett , John Graeme Wood, ...]",British National Party (1960s),british_national_party_(1960s)
185,No,34,Portugal,movement,"[Amadora, Assassination, Capitalism, Communism, Constitution of Portugal, Democratic Renovator Party , Fascism, José Carvalho, Liberal democracy, Lisbon, National Action Movement , National Renewal Party, Party politics, Politics, Portugal, Portuguese Constitutional Court, Skinhead, Trotskyite, White power skinhead]","Movimento de Acção Nacional (MAN, ""National Action Movement"")","movimento_de_ac??o_nacional_(man_""national_action_movement"")"
186,No,0,Sweden,movement,"[1934 Montreux Fascist conference, 4th of August Regime, 6 February 1934 crisis, Abba Ahimeir, Acerbo Law, Actual idealism, Adolf Hitler, Adrian Molin, Afrikaner Weerstandsbeweging, Agostino Lanzillo, Ahnenerbe, Ailtirí na hAiséirghe, Albanian Fascist Militia, Albanian Fascist Party, Alfred Ploetz, Alfred Rosenberg, Alfredo Rocco, Allach , Alphonse de Châteaubriant, Alt-right, Alternative for Sweden, Anastasy Vonsiatsky, Ante Pavelić, Anti-Comintern Pact, Anti-Nazi League, Anti-capitalism, Anti-communism, Anti-fascism, Ardengo Soffici, Arditi, Arrow Cross Party, Art of the Third Reich, Austrian National Socialism, Austrofascism, Authoritarianism, Aventine Secession , Axis powers, Beer Hall Putsch, Benito Mussolini, Bevara Sverige Svenskt, Birger Furugård, Black Brigades, Black Front , Blackshirts, Blue Shirts Society, Blueshirts, Brazilian Integralism, Breton Social-National Workers' Movement, Brit HaBirionim, British Fascism, British Fascists, British People's Party , British Union of Fascists, Canadian Union of Fascists, Carl-Ehrenfried Carlberg, Carl Schmitt, Carlo Costamagna, Chamber of Fasci and Corporations, Christofascism, Class collaboration, Clerical People's Party, Clerical fascism, Conservatism, Corfu incident, Corneliu Zelea Codreanu, Corporatism, Crusade of Romanianism, Crypto-fascism, Curzio Malaparte, Das Reich , Das Schwarze Korps, Definitions of fascism, Democratic Fascist Party, Denazification, Der Angriff, Der Stürmer, Deutsche Allgemeine Zeitung, Deutsche Zeitung in Norwegen, Deutsche Zeitung in den Niederlanden, Dictatorship, Dimitrije Ljotić, Dionisio Ridruejo, Easter Riots, Economic interventionism, Economics of fascism, Einsatzgruppen, Elof Eriksson, Enabling Act of 1933, Enrico Corradini, Eoin O'Duffy, Esoteric Nazism, Eugenics, European Social Movement, European Workers Party, Faisceau, Falange Española de las JONS, Falangism, Falangism in Latin America, Fall of the Fascist regime in Italy, Fascio, ...]",National Socialist Workers' Party (Swedish: Nationalsocialistiska Arbetarpartiet),national_socialist_workers'_party_(swedish:_nationalsocialistiska_arbetarpartiet)
