,active,community,country,label,links,name,title
105,,0,Albania,party,"[Abas Ermenji, Administrative divisions of Albania, Albania, Albanian Christian Democratic Movement, Albanian Fascist Party, Albanian constitutional referendum, 1994, Albanian constitutional referendum, 1998, Albanian language, Albanian local elections, 2007, Albanian local elections, 2011, Albanian local elections, 2015, Albanian monarchy referendum, 1997, Albanian nationalism, Albanian parliamentary election, 2009, Albanian parliamentary election, 2013, Albanian parliamentary election, 2017, Albanian presidential election, 2007, Albanian presidential election, 2012, Albanian presidential election, 2017, Ali Ahmeti, Anti-communism, Anti-fascism, Assembly of Albania, Assembly of Kosovo, Assembly of Macedonia, Balli Kombëtar, Black, Cabinet of Albania, Christian Democratic Party of Albania, Communist Party of Albania , Constitution of Albania, Constitutional Court of Albania, Counties of Albania, Demochristian Party of Albania, Democratic Alliance Party , Democratic Party of Albania, Democratic Party of Albanians, Democratic Union for Integration, Deputy Prime Minister of Albania, Ditmir Bushati, Edi Rama, Elections in Albania, English language, Foreign relations of Albania, Gramoz Ruçi, Greater Albania, Green Party of Albania, Guerrilla warfare, Human rights in Albania, Ilir Meta, Kosovo, Kosovo Liberation Army, Kosovo War, LIBRA, Leader of the Opposition , Legality Movement, Legality Movement Party, Liberal Democratic Union , Libra Party , Macedonian Alliance for European Integration, Macedonian autonomy referendum, 2004, Menduh Thaçi, Minister for Europe and Foreign Affairs , Ministry for Europe and Foreign Affairs , Movement for Solidarity, Municipalities of Albania, National Veteran's Committee, Nationalism, New Democratic Party , New Democratic Spirit, Outline of political science, Parliament of Albania, Party for Justice, Integration and Unity, Party of Labour of Albania, Political spectrum, Politics of Albania, President of Albania, Prime Minister of Albania, Red, Red and Black Alliance, Reorganised Party of Labour of Albania, Republic of Kosovo, Republic of Macedonia, Republican Party of Albania, Senida Mesi, Serbia, Sfida për Shqipërinë, Social Democracy Party of Albania, Social Democratic Party of Albania, Speaker of the Parliament of Albania, Supreme Court of Albania, Tetovo, Tirana, Union for Victory, Unity for Human Rights Party, Villages of Albania, Šar Mountains]",Albanian National Front Party,albanian_national_front_party
106,No,0,Norway,movement,"[1934 Montreux Fascist conference, 4th of August Regime, 6 February 1934 crisis, Abba Ahimeir, Acerbo Law, Actual idealism, Adolf Eichmann, Adolf Hitler, Adolf Hitler's rise to power, Afrikaner Weerstandsbeweging, Agostino Lanzillo, Ahnenerbe, Ailtirí na hAiséirghe, Aktion T4, Albanian Fascist Militia, Albanian Fascist Party, Albanian Resistance of World War II, Albert Speer, Albert Viljam Hagelin, Alfred Ploetz, Alfred Rosenberg, Alfredo Rocco, Allach , Alphonse de Châteaubriant, Alt-right, American Nazi Party, Anastasy Vonsiatsky, Anglo-Iraqi War, Anglo-Soviet invasion of Iran, Anschluss, Ante Pavelić, Anti-Comintern Pact, Anti-Masonry, Anti-Nazi League, Anti-communism, Anti-fascism, Antisemitism, Ardengo Soffici, Arditi, Argentina during World War II, Arizona during World War II, Arrow Cross Party, Art of the Third Reich, Artur Axmann, Austrian National Socialism, Austrofascism, Authoritarianism, Aventine Secession , Axis powers, Azerbaijan in World War II, Baldur von Schirach, Beer Hall Putsch, Belgian Congo in World War II, Belgium in World War II, Benito Mussolini, Black Brigades, Black Front , Blackshirts, Blood and Soil, Blue Shirts Society, Blueshirts, Brazilian Integralism, Breton Social-National Workers' Movement, Brit HaBirionim, British Empire in World War II, British Fascism, British Fascists, British Guiana during World War II, British People's Party , British Union of Fascists, Canadian Union of Fascists, Capital punishment, Carl Schmitt, Carlo Costamagna, Ceylon in World War II, Chamber of Fasci and Corporations, Christofascism, Class collaboration, Clerical People's Party, Clerical fascism, Coat of arms of Norway, Colombia during World War II, Consequences of Nazism, Conservatism, Constitution of Norway, Corfu incident, Corneliu Zelea Codreanu, Corporatism, Criticism of democracy, Crusade of Romanianism, Crypto-fascism, Cuba during World War II, Curzio Malaparte, Das Reich , Das Schwarze Korps, Definitions of fascism, Democratic Fascist Party, Denazification, Denmark in World War II, Der Angriff, ...]",Nasjonal Samling (NS),nasjonal_samling_(ns)
107,?,24,Russia,movement,[],"Northern Alliance (Severny Alliyans, Северный Альянс)[citation needed]",northern_alliance_(severny_alliyans_????????_??????)[citation_needed]
108,,9,Slovenia,party,"[Active Slovenia, Akacija, Alliance of Alenka Bratušek, Anti-clerical, Bužini, Chauvinist, Coat of Arms of Slovenia, Croatia, Democratic Party of Pensioners of Slovenia, Democratic Party of Slovenia, Democratic election, Elections in Slovenia, Euroscepticism, Flag of Slovenia, Forward Slovenia, Gay rights, Good Country, Greens of Slovenia, Historical negationism, Humana Party, Josip Broz Tito, Kosovo, Laicism, League of Communists of Slovenia, Left-wing politics, Left–right political spectrum, Liberal Democracy of Slovenia, Lipa , Ljubljana, Mladina, Mlini, Modern Centre Party, Movement for Slovenia, NATO, National Democratic Party , Nationalism, New Slovenia, Party of Equal Opportunities Slovenia, Party of Slovenian People, Piran, Pirate Party , Political spectrum, Politics of Slovenia, Positive Slovenia, Psychology Press, Racist, Romani people, Serbia, Serbian Radical Party, Slovene Christian Democrats, Slovene Home Guard, Slovene Partisans, Slovene diaspora, Slovene language, Slovenia, Slovenia is Ours, Slovenian Democratic Party, Slovenian Democratic Union, Slovenian National Assembly, Slovenian National Right, Slovenian People's Party, Slovenian nationalism, Slovenian parliamentary election, 1992, Slovenian parliamentary election, 1996, Slovenian parliamentary election, 2000, Slovenian parliamentary election, 2004, Slovenian parliamentary election, 2008, Slovenian parliamentary election, 2011, Slovenian parliamentary election, 2014, Slovenian parliamentary election, 2018, Slovenian presidential election, 2002, Slovenian presidential election, 2007, Social Democrats , The Left , Ultranationalism, United Left , United Slovenia, Unity , University of Ljubljana, Verjamem, Vojislav Šešelj, Wayback Machine, World War II, Yellow, Youth Party – European Greens, Yugoslavia, Zares, Zemljovid Slovenske dežele in pokrajin, Zmago Jelinčič Plemeniti, Škodelini, Škrile]",Slovenian National Party,slovenian_national_party
109,,0,Czech Republic,party,"[1934 Montreux Fascist conference, 4th of August Regime, 6 February 1934 crisis, Abba Ahimeir, Acerbo Law, Actual idealism, Administrative divisions of Nazi Germany, Adolf Eichmann, Adolf Hitler, Adolf Hitler's rise to power, Adolf Wagner, Adrian Weale, Afrikaner Weerstandsbeweging, Agostino Lanzillo, Agrarianism, Agricultural League, Ahnenerbe, Ailtirí na hAiséirghe, Aktion T4, Albanian Fascist Militia, Albanian Fascist Party, Albert Forster, Albert Hoffmann , Albert Krebs, Albert Speer, Alfred Eduard Frauenfeld, Alfred Hugenberg, Alfred Meyer, Alfred Ploetz, Alfred Rosenberg, Alfredo Rocco, Allach , Allgemeine SS, Allied Control Council, Allies of World War II, Alois Bachschmidt, Alphonse de Châteaubriant, Alsace, Alt-right, American Nazi Party, Amt Rosenberg, An Essay on the Inequality of the Human Races, Anastasy Vonsiatsky, Andreas Bolek, Anschluss, Ante Pavelić, Anti-Comintern Pact, Anti-Marxist, Anti-Nazi League, Anti-capitalism, Anti-communism, Anti-fascism, Antisemitic, Antisemitic canard, Antisemitism, Anton Drexler, Anton Haselmayer, Arbeitertum, Ardengo Soffici, Arditi, Aria Party, Aristocracy , Armistice with Germany , Arrow Cross Party, Art of the Third Reich, Arthur Karl Greiser, Arthur Seyß-Inquart, Arthur de Gobineau, Artur Axmann, Artur Dinter, Aryan race, Augsburg, August Eigruber, Austria, Austrian National Socialism, Austrofascism, Authoritarianism, Aventine Secession , Axis powers, Azure Party, Baldur von Schirach, Basic Law for the Federal Republic of Germany, Bavaria, Bavarian Peasants' League, Bavarian People's Party, Bayreuth, Beer Hall Putsch, Beneš decrees, Benito Mussolini, Bernhard Rust, Bibliothèque nationale de France, Big business, Black Brigades, Black Front, Black Front , Blackshirts, Blockleiter, Blood and Soil, Blood and soil, Bloodlands: Europe Between Hitler and Stalin, ...]",Workers' Party,workers'_party
110,No,11,Bulgaria,movement,"[Aleksandar Stamboliyski, Andrei Toshev, Authoritarian, Axis Powers, Benito Mussolini, Boris III, Bulgaria, Bulgarian Army, Bulgarian Communist Party, Bulgarian coup d'état of 1934, Bulgarian language, Ceasefire, Corporatism, Corporativism, Damyan Velchev, Elections in Bulgaria, Fascism, Fatherland Front , France, Georgi Dimitrov, Greater Yugoslavia, Internal Macedonian Revolutionary Organization, Italy, Kimon Georgiev, Macedonia , Nationalism, Newspaper, Pencho Zlatev, People's Republic, Political spectrum, Politics of Bulgaria, Sofia, Soviet Union, Statism, Trade union, Zveno ]",Zveno,zveno
111,,4,Italy,party,"[Nicola Mancino, Italy, Teodoro Buontempo, Roberto Fiore, Italian general election, 2008, British National Party, la Repubblica, Chamber of Deputies , Phoenix, Arizona, Catholic church, Black, Italian general election, 2018, Margaret Thatcher, Ultranationalism, Pino Rauti, New Jersey, Bologna massacre, neo-fascist, Italian Senate, political refugees, Fascism, Cave, Lazio, immigration to Italy, capitalism, Freemasonry, Nazi punk, public debt, Massimo Morsello, War in Donbass, Tricolour Flame, Social Alternative, Alessandra Mussolini, Lazio, Radical right , population growth, Italian referendums, 1981, Italian Chamber of Deputies, Lateran Treaty, immigration, SITE Intelligence Group, Latina, Lazio, Rome, Italy for the Italians, Mario Scelba, Italy to the Italians, National Alliance , Svoboda , Italian general election, 2006, usury, United States, Senate of Italy, England, Lisbon Treaty, NATO, Forza Italia, abortion, Alliance for Peace and Freedom, Euroscepticism, London, Italian general election, 2013, Francesco Storace, Nuclei Armati Rivoluzionari, Italian general election, 2001, same-sex marriage]",New Force,new_force
112,No,0,Czechoslovakia,movement,"[1934 Montreux Fascist conference, 4th of August Regime, 6 February 1934 crisis, Abba Ahimeir, Acerbo Law, Actual idealism, Adolf Hitler, Afrikaner Weerstandsbeweging, Agostino Lanzillo, Agriculture, Ahnenerbe, Ailtirí na hAiséirghe, Albanian Fascist Militia, Albanian Fascist Party, Alfred Ploetz, Alfred Rosenberg, Alfredo Rocco, Allach , Alphonse de Châteaubriant, Alt-right, Anastasy Vonsiatsky, Ante Pavelić, Anti-Comintern Pact, Anti-Nazi League, Anti-communism, Anti-fascism, Antisemitism, Ardengo Soffici, Arditi, Arrow Cross Party, Art of the Third Reich, Austrian National Socialism, Austrofascism, Authoritarianism, Aventine Secession , Axis powers, Beer Hall Putsch, Benito Mussolini, Black , Black Brigades, Black Front , Blackshirts, Blue Shirts Society, Blueshirts, Bohemia, Brazilian Integralism, Breton Social-National Workers' Movement, Brit HaBirionim, British Fascism, British Fascists, British People's Party , British Union of Fascists, Brno, Canadian Union of Fascists, Carl Schmitt, Carlo Costamagna, Chamber of Fasci and Corporations, Christofascism, Class collaboration, Clerical People's Party, Clerical fascism, Communism, Conservatism, Corfu incident, Corneliu Zelea Codreanu, Corporatism, Coup d'etat, Crusade of Romanianism, Crypto-fascism, Curzio Malaparte, Czech language, Czechoslovak, Czechoslovak Legions, Czechoslovak National Democracy, Czechoslovakian parliamentary election, 1929, Das Reich , Das Schwarze Korps, Definitions of fascism, Democratic Fascist Party, Denazification, Der Angriff, Der Stürmer, Deutsche Allgemeine Zeitung, Deutsche Zeitung in Norwegen, Deutsche Zeitung in den Niederlanden, Dictatorship, Dimitrije Ljotić, Dionisio Ridruejo, Economic interventionism, Economics of fascism, Einsatzgruppen, Elections in Czechoslovakia, Enabling Act of 1933, Enrico Corradini, Eoin O'Duffy, Esoteric Nazism, Eugenics, Faisceau, Falange Española de las JONS, Falangism, ...]",National Fascist Community (NOF),national_fascist_community_(nof)
113,No,0,Albania,movement,"[1934 Montreux Fascist conference, 4th of August Regime, 6 February 1934 crisis, Abba Ahimeir, Acerbo Law, Achille Starace, Actual idealism, Administrative divisions of Albania, Adolf Hitler, Afrikaner Weerstandsbeweging, Agostino Lanzillo, Ahnenerbe, Ailtirí na hAiséirghe, Albania, Albania between wars, Albanian Christian Democratic Movement, Albanian Fascist Militia, Albanian Kingdom , Albanian Kingdom , Albanian Lictor Youth, Albanian National Front Party, Albanian constitutional referendum, 1994, Albanian constitutional referendum, 1998, Albanian language, Albanian local elections, 2007, Albanian local elections, 2011, Albanian local elections, 2015, Albanian monarchy referendum, 1997, Albanian nationalism, Albanian parliamentary election, 2009, Albanian parliamentary election, 2013, Albanian parliamentary election, 2017, Albanian presidential election, 2007, Albanian presidential election, 2012, Albanian presidential election, 2017, Albanians, Alfred Ploetz, Alfred Rosenberg, Alfredo Rocco, Allach , Allies of World War II, Alphonse de Châteaubriant, Alt-right, Anastasy Vonsiatsky, Ante Pavelić, Anti-Comintern Pact, Anti-Nazi League, Anti-communism, Anti-fascism, Ardengo Soffici, Arditi, Arrow Cross Party, Art of the Third Reich, Austrian National Socialism, Austrofascism, Authoritarianism, Aventine Secession , Axis powers, Balli Kombëtar, Beer Hall Putsch, Benito Mussolini, Bernd Jürgen Fischer, Black, Black Brigades, Black Front , Blackshirts, Blue Shirts Society, Blueshirts, Brazilian Integralism, Breton Social-National Workers' Movement, Brit HaBirionim, British Fascism, British Fascists, British People's Party , British Union of Fascists, Cabinet of Albania, Canadian Union of Fascists, Carl Schmitt, Carlo Costamagna, Chamber of Fasci and Corporations, Christian Democratic Party of Albania, Christofascism, Class collaboration, Clerical People's Party, Clerical fascism, Communist Party of Albania , Conservatism, Constitution of Albania, Constitutional Court of Albania, Corfu incident, Corneliu Zelea Codreanu, Corporatism, Counties of Albania, Crusade of Romanianism, Crypto-fascism, Curzio Malaparte, Das Reich , Das Schwarze Korps, Definitions of fascism, Demochristian Party of Albania, ...]",Albanian Fascist Party,albanian_fascist_party
114,Yes,6,Belarus,movement,"[12 Who Don't Agree, 15th Waffen Grenadier Division of the SS , 1993 Russian constitutional crisis, 2002 Prague summit, 2006 Russian March, 2014 pro-Russian unrest in Ukraine, Aijo Beness, Aleksandr Averin , Aleksandr Dugin, Aleksandr Nepomniachtchi, All-Russia People's Front, All-Russian Fascist Organisation, All-Russian nation, Andrei Dmitriev , Anti-Americanism, Anti-Western sentiment, Anti-capitalism, Anti-globalization movement, Antisemitism, Black Front, Black Hundreds, Bolsheviks, Bureaucracy, Cas Mudde, Charles, Prince of Wales, Collector of Russian lands, Columbia University Press, Communism, Communist Party of the Russian Federation, Congress of Russian Communities, Da, smert, Derzhava , Dimitri Kitsikis, Direct-action, Direct action, Dissenters' March, Dissenters March, Donetsk Republic , Eduard Limonov, Elections in Russia, Emmanuel Carrère, Ernst Jünger, Ernst Niekisch, Essence of Time , Eurasia Party, Eurasian Youth Union, Eurasianism, F1 grenade , Fascism, Fascist Union of Youth, Fashist, For the Native Language!, Format18, Foundations of Geopolitics, Francis Parker Yockey, Fritz Wolffheim, Great Russia , Gregor Strasser, Grenades, Hans von Hentig, Heinrich Laufenberg, Imperialism, International Standard Book Number, Jean-François Thiriart, Joseph Stalin, Karl Otto Paetel, Karl Radek, Kazakhstan, Kim Il-Sung, Latvian Legion Day, Lefortovo Prison, Left-wing nationalism, Left-wing politics, Left-wing populism, Lehi , Liberal Democratic Party of Russia, Liberal Democratic Party of the Soviet Union, Liberalism, Limonka , Limonov , Lower court, Luc Michel, Martin A. Lee, Maxim Gromov, Mihai Stelescu, Mikhail Agursky, Mikhail Evstafiev, Minsk, Mladorossi, Moscow, Moscow Oblast, Movement Against Illegal Immigration, Murder of Yuriy Chervochkin, NATO, Nash Put' , Nashi , Nashi , Nashism, Natalia Medvedeva , National Alliance of Russian Solidarists, ...]",National Bolshevik Party-Belarus,national_bolshevik_party_belarus
115,Yes,1,Sweden,movement,"[Adrian Molin, Afrikaner Weerstandsbeweging, Albert Spaggiari, Alexander Barkashov, Alternative for Sweden, American Front, American Nazi Party, Anders Behring Breivik, Andrew Anglin, Antipodean Resistance, Artgemeinschaft, Arthur J. Jones, Aryan Guard, Aryan Nations, Aryan Republican Army, Atomwaffen Division, Azov Battalion, Bela Ewald Althans, Bert Eriksson, Bevara Sverige Svenskt, Birger Furugård, Black Order , Blanke Bevrydingsbeweging, Bloed, Bodem, Eer en Trouw, Blood & Honour, Bosnian Movement of National Pride, British Movement, CEDADE, Canadian Nazi Party, Carl-Ehrenfried Carlberg, Christian Worch, Colin Jordan, Colin King-Ansell, Combat 18, Creativity , David Lane , David Myatt, Davud Monshizadeh, Deutsche Heidnische Front, Deutsche Reichspartei, Don Black , Elof Eriksson, Ernst Zündel, Eugène Terre'Blanche, European Liberation Front, European Social Movement, European Workers Party, Eustace Mullins, Florentine Rost van Tonningen, Francis Parker Yockey, Franco Freda, Françoise Dior, Free German Workers' Party, Fritz Rössler, Gary Lauck, Gary Schipper, Gaston-Armand Amaudruz, George Burdi, George Lincoln Rockwell, German Alternative, German Social Union , Gesinnungsgemeinschaft der Neuen Front, Golden Dawn , Gottfried Küssel, H. Keith Thompson, Hammerskins, Hampus Hellekant, Hans-Ulrich Rudel, Harold Covington, Heathen Front, Heritage Front, Horst Mahler, Horst Rosenkranz, Hungarian National Front, Ian Stuart Donaldson, Info-14, István Győrkös, Jack van Tongeren, Jackie Arklöv, Jacques de Mahieu, James H. Madole, James Mason , Jeff Schoep, Jimmie Åkesson, John Hron, John Tyndall , Joseph Tommasi, Kerry Bolton, Klas Lund, Konstantin Kasimovsky, Landig Group, Legion Wasa, Léon Degrelle, Manfred Roeder, Mark Fredriksen, Martin Ekström, Martin Webster, Matthew Heimbach, Matthias Koehl, Michael Kühnen, ...]",Nordic Realm Party,nordic_realm_party
116,,3,Finland,party,"[Affirmative action, Agriculture, Alexander Stubb, Alliance of Conservatives and Reformists in Europe, Animal Justice Party of Finland, Anne Louhelainen, Anssi Joutsenlahti, Ari Jalonen, Arja Juvonen, Authoritarianism, BBC News, Begging, Blue, Blue Reform, Blue and White Front, Blue collar, Board of directors, Capital gains tax, Central Finland , Centre , Centre Party , Change 2011, Christian Democrats , Citizens' Party , Coalition government, Communist Party of Finland , Communist Workers' Party – For Peace and Socialism, Conservative Party , Digital object identifier, Economic nationalism, Eero Heinäluoma, Elections in Finland, Electoral districts of Finland, Etelä-Suomen Sanomat, Ethnic nationalism, Euro, Europe, Europe of Freedom and Democracy, European Conservatives and Reformists, European Economic Area, Eurosceptic, Euroscepticism, Facebook, Feminist Party , Finland, Finland Proper , Finland Swedish, Finnish Defence Forces, Finnish Islamic Party, Finnish Parliament, Finnish Party, Finnish Rural Party, Finnish language, Finnish municipal election, 1996, Finnish municipal election, 2000, Finnish municipal election, 2004, Finnish municipal election, 2008, Finnish municipal election, 2012, Finnish municipal elections, 2017, Finnish nationalism, Finnish parliamentary election, 1970, Finnish parliamentary election, 1983, Finnish parliamentary election, 1995, Finnish parliamentary election, 1999, Finnish parliamentary election, 2003, Finnish parliamentary election, 2007, Finnish parliamentary election, 2011, Finnish parliamentary election, 2015, Finnish parliamentary election 2011, Finnish presidential election, 2000, Finnish presidential election, 2006, Finnish presidential election, 2012, Finnish presidential election, 2018, Finns Party Youth, Finns Party leadership election, 2017, For the Poor, Globalism, Gold , Green League, Hakaniemi, Hanna Mäntylä, Hannu Purho, Helsingin Sanomat, Helsinki, Helsinki , Ilkka Hakalehto, Iltalehti, In vitro fertilization, Independence Day , Independence Party , Independent politician, Ismo Soukola, James Hirvisaari, Jan Sundberg, Jani Mäkelä, Jari Lindström, Jari Ronkainen, Johanna Jurva, Juha Sipilä, Juha Väätäinen, ...]",Finns Party,finns_party
117,No,0,Romania,movement,"[1934 Montreux Fascist conference, 1 Decembrie 1918 University, Alba Iulia, 4th of August Regime, 6 February 1934 crisis, A. C. Cuza, Abba Ahimeir, Acerbo Law, Actual idealism, Adolf Hitler, Afrikaner Weerstandsbeweging, Agenția de presă RADOR, Agostino Lanzillo, Agrarian League , Agrarian Union Party, Ahnenerbe, Ailtirí na hAiséirghe, Albanian Fascist Militia, Albanian Fascist Party, Alexandru Averescu, Alexandru Randa, Alexandru Talex, Alexandru Vaida-Voevod, Alfred Bonfert, Alfred Ploetz, Alfred Rosenberg, Alfredo Rocco, Allach , Allies of World War II, Alphonse de Châteaubriant, Alt-right, American Jewish Committee, Anarchism, Anastasy Vonsiatsky, Angelo Mitchievici, Ante Pavelić, Anti-Comintern Pact, Anti-Nazi League, Anti-communism, Anti-fascism, Anticapitalism, Anticommunism, Antisemitism, Appendectomy, Ardengo Soffici, Arditi, Aromanians, Arrow Cross Party, Art of the Third Reich, Austrian National Socialism, Austrofascism, Authoritarianism, Aventine Secession , Axis Powers, Axis powers, Babeș-Bolyai University, Beer Hall Putsch, Benito Mussolini, Bessarabian Peasants' Party, Black Brigades, Black Front , Blackshirts, Blue Shirts Society, Blueshirts, Brazilian Integralism, Breton Social-National Workers' Movement, Brit HaBirionim, British Fascism, British Fascists, British People's Party , British Union of Fascists, Brâncovenesc Hospital, Bucharest, Camarilla, Canadian Union of Fascists, Carl Schmitt, Carlo Costamagna, Carmine , Carol II of Romania, Cayetano Córdova Iturburu, Censorship in Communist Romania, Centrism, Chamber of Fasci and Corporations, Christofascism, Citizen Bloc, City Lights Bookstore, Class collaboration, Clerical People's Party, Clerical fascism, Comintern, Communism, Communist Romania, Communization, Conservatism, Conservative-Democratic Party, Conservative Party , Constantin Karadja, Constantin Rădulescu-Motru, Constantin Virgil Gheorghiu, Convorbiri Literare, Corfu incident, ...]",Crusade of Romanianism,crusade_of_romanianism
118,,2,Lithuania,party,"[1926 Lithuanian coup d'état, 1934 Montreux Fascist conference, Act of the Re-Establishment of the State of Lithuania, All for Latvia!, Antanas Smetona, Archive.is, Augustinas Voldemaras, Christian Conservative Social Union, Christian Democratic Union , Christian Party , Civic Democratic Party , Communist Party of Lithuania, Conservative People's Party of Estonia, Democratic Labour Party of Lithuania, Elections in Lithuania, Electoral Action of Poles in Lithuania, Encyclopedia Lituanica, Euroscepticism, Front Party, Gintaras Songaila, Globalism, Homeland Union, Independence Party , Iron Wolf , Kazimieras Uoka, Labour Party , Liberal Movement , Liberal Union of Lithuania, Liberal and Centre Union, Library of Congress Classification, Lithuania, Lithuanian Centre Party, Lithuanian Centre Union, Lithuanian Christian Democratic Party, Lithuanian Christian Democrats, Lithuanian Democratic Party, Lithuanian Farmers' Association, Lithuanian Farmers and Greens Union, Lithuanian Freedom Union , Lithuanian Green Party, Lithuanian Liberty League, Lithuanian Liberty Union, Lithuanian National Union, Lithuanian Peasants Party, Lithuanian People's Party, Lithuanian Russian Union, Lithuanian Social Democratic Union, Lithuanian Union of Political Prisoners and Deportees, Lithuanian language, Lithuanian parliamentary election, 1926, Lithuanian parliamentary election, 1992, Lithuanian parliamentary election, 1996, Lithuanian parliamentary election, 2000, Lithuanian parliamentary election, 2004, Lithuanian parliamentary election, 2016, Modern Christian-Democratic Union, National Democratic Party of Lithuania, National Resurrection Party, Nationalism, New Democracy Party , New Union , Order and Justice, Party of National Progress, Political spectrum, Politics of Lithuania, President of Lithuania, Prime Minister of Lithuania, Sakalas Gorodeckis, Samogitian Party, Seimas, Social Democratic Labour Party of Lithuania, Social Democratic Party of Lithuania, Sąjūdis, The Way of Courage, Unified Lithuanian National Workers Movement, Vilnius, YES , Young Communist League of Lithuania , Young Lithuania]",Lithuanian Nationalist Union,lithuanian_nationalist_union
